{
  "$schema": "https://json-schema.org/draft/2020-12/schema",
  "$id": "absolute_majority_input_schema.json",
  "title": "Absolute Majority NPC Event Input",
  "description": "Input passed from Absolute Majority into Political Human Skill for persona action selection.",
  "type": "object",
  "required": [
    "persona_id",
    "event_id",
    "event_type",
    "policy_issue",
    "public_support_rate",
    "party_order",
    "faction_order",
    "district_pressure",
    "media_pressure",
    "player_instruction",
    "candidate_actions",
    "current_relationship",
    "recent_memory",
    "parliament_context",
    "party_context"
  ],
  "properties": {
    "persona_id": {
      "type": "string",
      "minLength": 1
    },
    "event_id": {
      "type": "string",
      "minLength": 1
    },
    "event_type": {
      "type": "string",
      "minLength": 1
    },
    "policy_issue": {
      "type": "string",
      "minLength": 1
    },
    "public_support_rate": {
      "type": "number",
      "minimum": 0,
      "maximum": 100
    },
    "party_order": {
      "type": "string"
    },
    "faction_order": {
      "type": "string"
    },
    "district_pressure": {
      "type": "string"
    },
    "media_pressure": {
      "type": "string"
    },
    "player_instruction": {
      "type": "string"
    },
    "candidate_actions": {
      "type": "array",
      "minItems": 1,
      "uniqueItems": true,
      "items": {
        "type": "string",
        "minLength": 1
      }
    },
    "current_relationship": {
      "type": "object",
      "required": [
        "familiarity",
        "trust",
        "respect",
        "affection",
        "caution",
        "dependency"
      ],
      "properties": {
        "familiarity": {
          "type": "number",
          "minimum": 0,
          "maximum": 100
        },
        "trust": {
          "type": "number",
          "minimum": 0,
          "maximum": 100
        },
        "respect": {
          "type": "number",
          "minimum": 0,
          "maximum": 100
        },
        "affection": {
          "type": "number",
          "minimum": 0,
          "maximum": 100
        },
        "caution": {
          "type": "number",
          "minimum": 0,
          "maximum": 100
        },
        "dependency": {
          "type": "number",
          "minimum": 0,
          "maximum": 100
        }
      },
      "additionalProperties": true
    },
    "recent_memory": {
      "type": "array",
      "items": {
        "type": "string"
      }
    },
    "parliament_context": {
      "type": "object",
      "required": [
        "ruling_seats",
        "opposition_seats",
        "committee_stage",
        "vote_margin_estimate"
      ],
      "properties": {
        "ruling_seats": {
          "type": "integer",
          "minimum": 0
        },
        "opposition_seats": {
          "type": "integer",
          "minimum": 0
        },
        "committee_stage": {
          "type": "string",
          "minLength": 1
        },
        "vote_margin_estimate": {
          "type": "integer"
        }
      },
      "additionalProperties": true
    },
    "party_context": {
      "type": "object",
      "required": [
        "party_name",
        "faction_name",
        "leadership_stability"
      ],
      "properties": {
        "party_name": {
          "type": "string",
          "minLength": 1
        },
        "faction_name": {
          "type": "string",
          "minLength": 1
        },
        "leadership_stability": {
          "type": "number",
          "minimum": 0,
          "maximum": 100
        }
      },
      "additionalProperties": true
    }
  },
  "additionalProperties": true
}
